"From Concept to Reality: Fast-Track Your AI Agents with Trusted Enterprise Data [THR3960] banner",https://reg.rf.oracle.com/flow/oracle/ocw25/catalog/page/catalog/session/1756230664352001Rfqv
"From Conversation to Completion: Scaling Intelligent CX with Zoom and Oracle [PAN4070] banner",https://reg.rf.oracle.com/flow/oracle/ocw25/catalog/page/catalog/session/1757715845869001uF9z
"From Data to Decisions: Empowering Business Growth with Trinamix AI Solutions [THR3843] banner",https://reg.rf.oracle.com/flow/oracle/ocw25/catalog/page/catalog/session/1754981829276001xXd3
"From Disconnected Systems to Unified Oracle Data via Data Pipelines, AI, and SQL [LRN3829] banner",https://reg.rf.oracle.com/flow/oracle/ocw25/catalog/page/catalog/session/1754946950099001R01k
"From Failure to Fixes: AI Infrastructure Management Made Easy with OCI [LRN3344] banner",https://reg.rf.oracle.com/flow/oracle/ocw25/catalog/page/catalog/session/1750959540583001sRqc
"From First Steps to Sustainment to AI Agents: A Panel on Oracle Cloud Growth [PAN3805] banner",https://reg.rf.oracle.com/flow/oracle/ocw25/catalog/page/catalog/session/1754873700095001aKBs
"From Foundation to Outcome: Fine Tune Large Language Models for Business Success [LRN1223] banner",https://reg.rf.oracle.com/flow/oracle/ocw25/catalog/page/catalog/session/1746023708446001yPB9
"From Insight to Impact: OCI AI Services in Oracle Analytics [HOL3473] banner",https://reg.rf.oracle.com/flow/oracle/ocw25/catalog/page/catalog/session/1751317091298001JKB9
"From Legacy to Leadership: Reimagining the Future of Finance [PAN3865] banner",https://reg.rf.oracle.com/flow/oracle/ocw25/catalog/page/catalog/session/1755122137682001KhDh
"From Many ERPs to One Truth: Manufacturing Data Modernization with Oracle Cloud [THR3983] banner",https://reg.rf.oracle.com/flow/oracle/ocw25/catalog/page/catalog/session/1756445367260001GYn3
"From Oracle Legacy to AI-Ready: A Blueprint for No-Risk Database Modernization [LRN3811] banner",https://reg.rf.oracle.com/flow/oracle/ocw25/catalog/page/catalog/session/1754921447302001Xi7X
"From Plan to Reality: How Organizations Are Continually Innovating with AI [PAN3126] banner",https://reg.rf.oracle.com/flow/oracle/ocw25/catalog/page/catalog/session/1750092303096001m9Zf
"From Prompts to Fine-Tuning: Harnessing AI & LLMs for the Utility Sector [LRN1133] banner",https://reg.rf.oracle.com/flow/oracle/ocw25/catalog/page/catalog/session/1745350478062001utyg
"From Questions to Insights: Using AI with Oracle Analytics to Unlock Your Data [LRN2909] banner",https://reg.rf.oracle.com/flow/oracle/ocw25/catalog/page/catalog/session/1748639950392001bu7L
"From Setup to Insights: Using AI Across Oracle CX Apps  [SHO3075] banner",https://reg.rf.oracle.com/flow/oracle/ocw25/catalog/page/catalog/session/1749653071916001Rk0i
"From Strategy to Success: The AI-Powered Enterprise [SOL3993] banner",https://reg.rf.oracle.com/flow/oracle/ocw25/catalog/page/catalog/session/1756706152352001w7WA
"Full-Stack GPU and ML Workload Observability and Health Check with OCI Lens [LRN1766] banner",https://reg.rf.oracle.com/flow/oracle/ocw25/catalog/page/catalog/session/1747851595265001vGSs
"Fusion AI Agents Boost Efficiency for Healthcare Nonprofit [THR3803] banner",https://reg.rf.oracle.com/flow/oracle/ocw25/catalog/page/catalog/session/1754711500950001eW1x
"Fusion Applications Suite: Built for Your Business in the Age of AI [SHO3421] banner",https://reg.rf.oracle.com/flow/oracle/ocw25/catalog/page/catalog/session/1751303809959001d2Kd
"Fusion Data Intelligence Extensibility and AI Integration [LRN3446] banner",https://reg.rf.oracle.com/flow/oracle/ocw25/catalog/page/catalog/session/1751311526928001l0xZ
"GenAI/AI Agent Enablement: Client Success Stories from KPMG-Oracle Hackathon [THR3778] banner",https://reg.rf.oracle.com/flow/oracle/ocw25/catalog/page/catalog/session/1754519757780001IsKA
"Generalizing Oracle HCM: Building a Scalable Framework for M&As [SPO4025] banner",https://reg.rf.oracle.com/flow/oracle/ocw25/catalog/page/catalog/session/1757360991326001rGYn
"Generative AI in Business Applications: Insights and Strategies [BOF3082] banner",https://reg.rf.oracle.com/flow/oracle/ocw25/catalog/page/catalog/session/1749741675111001Y7Jz
"Get Started with AI Agents Using Select AI on Autonomous Database [HOL2802] banner",https://reg.rf.oracle.com/flow/oracle/ocw25/catalog/page/catalog/session/1748409783540001LFLc
"Getting Started with Agentic AI Using Oracle Integration [SHO2796] banner",https://reg.rf.oracle.com/flow/oracle/ocw25/catalog/page/catalog/session/1748364553237001THZ4
"Getting Started with AI in Government and Education [PAN3566] banner",https://reg.rf.oracle.com/flow/oracle/ocw25/catalog/page/catalog/session/1751463454656001L9K4
"Getting Started with Fusion Data Intelligence and AI Assistant [PI3467] banner",https://reg.rf.oracle.com/flow/oracle/ocw25/catalog/page/catalog/session/1751316284842001XVak
"Getting Started with Oracle AI Vector Search (Offering 2) [HOL3731] banner",https://reg.rf.oracle.com/flow/oracle/ocw25/catalog/page/catalog/session/1753810682507001wVFj
"Getting Started with Oracle AI Vector Search [HOL2804] banner",https://reg.rf.oracle.com/flow/oracle/ocw25/catalog/page/catalog/session/1748410043952001M1Tz
"GoldenGate Everywhere: Real-Time Multicloud Streaming with Azure and Google [SHO3050] banner",https://reg.rf.oracle.com/flow/oracle/ocw25/catalog/page/catalog/session/1749152230768001hOiX
"Growing Profitable Asset-Based Services Business in High Tech and Manufacturing [PAN3468] banner",https://reg.rf.oracle.com/flow/oracle/ocw25/catalog/page/catalog/session/1751316539573001IhCR
"HCM Analytics in Action: A Hands-On Lab for AI-Driven People Intelligence [HOL3457] banner",https://reg.rf.oracle.com/flow/oracle/ocw25/catalog/page/catalog/session/1751315305627001dxiE
"How a Large Healthcare Provider Processes Over 2B Medical Records with Oracle AI [LRN3262] banner",https://reg.rf.oracle.com/flow/oracle/ocw25/catalog/page/catalog/session/1750826327922001MKIP
"How Customers Are Bringing AI to Their Mission-Critical Data [PAN3308] banner",https://reg.rf.oracle.com/flow/oracle/ocw25/catalog/page/catalog/session/1750884972037001Qj4I
"How Dedicated Clouds Shape the Future of Public Cloud Services [BOF3528] banner",https://reg.rf.oracle.com/flow/oracle/ocw25/catalog/page/catalog/session/1751325217427001LRGk
"How onsemi Transformed Enterprise Operations with AI Chatbots  [THR3986] banner",https://reg.rf.oracle.com/flow/oracle/ocw25/catalog/page/catalog/session/1756475602783001q7py
"How Oracle AI Agents Are Changing the Game for Fusion and Hosted On-Prem Apps [THR3819] banner",https://reg.rf.oracle.com/flow/oracle/ocw25/catalog/page/catalog/session/1754938132527001kvZY
"How Oracle Integration Powers the Future of Automation for Apps, Data, and AI [LRN2791] banner",https://reg.rf.oracle.com/flow/oracle/ocw25/catalog/page/catalog/session/1748349464887001Lshy
"How Oracle IT Charted Oracle’s Path to the Cloud, Enabled Successful AI Adoption [THR3290] banner",https://reg.rf.oracle.com/flow/oracle/ocw25/catalog/page/catalog/session/1750872090050001PPDu
"How Oracle’s Business Leaders Build Agents with Oracle AI Agent Studio [THR3095] banner",https://reg.rf.oracle.com/flow/oracle/ocw25/catalog/page/catalog/session/1750082350673001rnUW
"How Oracle Uses AI-Based Success Navigator to Uptake New AI Features [THR3094] banner",https://reg.rf.oracle.com/flow/oracle/ocw25/catalog/page/catalog/session/1750082211384001tHal
"How Oracle Uses AI in Analytics and Reporting to Help Make Better Decisions [THR3096] banner",https://reg.rf.oracle.com/flow/oracle/ocw25/catalog/page/catalog/session/1750082447924001sHnB
"How to Get Started with AI in Oracle Fusion Applications [PAN3152] banner",https://reg.rf.oracle.com/flow/oracle/ocw25/catalog/page/catalog/session/1750202506071001BPo4
"How to Put AI to Work Across the Business (Offering 1) [BOF3419] banner",https://reg.rf.oracle.com/flow/oracle/ocw25/catalog/page/catalog/session/1751303072571001mjVZ
"How to Put AI to Work Across the Business (Offering 2) [BOF3420] banner",https://reg.rf.oracle.com/flow/oracle/ocw25/catalog/page/catalog/session/1751303396101001Y0mJ
"How to Query Your Data Using Natural Language and AI [SHO2803] banner",https://reg.rf.oracle.com/flow/oracle/ocw25/catalog/page/catalog/session/1748409880365001vKVb
"Huhtamäki’s Multicloud ERP Journey: Consolidating 30 Systems with Oracle Fusion [THR2187] banner",https://reg.rf.oracle.com/flow/oracle/ocw25/catalog/page/catalog/session/1748001415904001LR0E
"Humana's Finance Modernization and the Role of FDI (Analytics/AI) with Deloitte [LRN3923] banner",https://reg.rf.oracle.com/flow/oracle/ocw25/catalog/page/catalog/session/1755723919132001p2m1
"Iceberg-Driven Lakehouse Architecture: Streamlining Load, Catalog & Analysis [LRN3161] banner",https://reg.rf.oracle.com/flow/oracle/ocw25/catalog/page/catalog/session/1750258222646001SgGI
"Improving Outcomes on a Global Scale with OCI [LRN2203] banner",https://reg.rf.oracle.com/flow/oracle/ocw25/catalog/page/catalog/session/1748006011763001WRQQ
"Industry Innovation Showcase [THR1136] banner",https://reg.rf.oracle.com/flow/oracle/ocw25/catalog/page/catalog/session/1745350896400001M1W2
"Inference Serving at Scale: Cost-Effective LLMs on Multi-GPU Systems [LRN3948] banner",https://reg.rf.oracle.com/flow/oracle/ocw25/catalog/page/catalog/session/1755909563565001lVA5
"In-N-Out Burger Serves Up Cloud Innovation with Success Navigator [THR3377] banner",https://reg.rf.oracle.com/flow/oracle/ocw25/catalog/page/catalog/session/1750979642501001Ac1R
"Innovative Payroll Solutions: Empowering Teams with Detailed Insights [THR1743] banner",https://reg.rf.oracle.com/flow/oracle/ocw25/catalog/page/catalog/session/1747842837309001iJCM
"Instant Payments and ISO 20022: When Speed Matters [LRN2883] banner",https://reg.rf.oracle.com/flow/oracle/ocw25/catalog/page/catalog/session/1748634911774001TBCP
"Intelligent Logistics Operations with Oracle B2B and Uber Freight [PAN3586] banner",https://reg.rf.oracle.com/flow/oracle/ocw25/catalog/page/catalog/session/1751492003497001JTdO
"Introducing Oracle Autonomous AI Lakehouse: Open Multicloud Data Platform [SOL3142] banner",https://reg.rf.oracle.com/flow/oracle/ocw25/catalog/page/catalog/session/1750180074720001T9xB
"Inventory & Warehouse Management Strategy & Roadmap: AI, User Experience, Mobile [PAN3011] banner",https://reg.rf.oracle.com/flow/oracle/ocw25/catalog/page/catalog/session/1748888659733001PcfY
"Is AI the New UI? Oracle's Approach in Redwood [LRN3139] banner",https://reg.rf.oracle.com/flow/oracle/ocw25/catalog/page/catalog/session/1750112959762001JQI4
"Is Your Oracle ERP Ready for AI Agents to Take Over the Night Shift? [SPO3749] banner",https://reg.rf.oracle.com/flow/oracle/ocw25/catalog/page/catalog/session/1753994997529001zfoA
"Lead Compliance with Confidence: CFOs Harness Oracle AI in Latin America [THR3751] banner",https://reg.rf.oracle.com/flow/oracle/ocw25/catalog/page/catalog/session/1754065835648001RMZh
"Learn How Webster Bank Modernized Their Close Using Oracle Cloud and GenAI [THR1084] banner",https://reg.rf.oracle.com/flow/oracle/ocw25/catalog/page/catalog/session/1745260988480001kjtA
"Leverage Oracle Biometrics and Vision AI to Improve Campus Safety [SHO1582] banner",https://reg.rf.oracle.com/flow/oracle/ocw25/catalog/page/catalog/session/1747684276483001jyxL
"Leveraging AI to Mitigate Cyberthreats in Altafiber’s Oracle Cloud Ecosystem [LRN3909] banner",https://reg.rf.oracle.com/flow/oracle/ocw25/catalog/page/catalog/session/1755543989245001wXNT
"Leveraging Oracle Autonomous AI JSON Database for Conversational AI Applications [LRN1172] banner",https://reg.rf.oracle.com/flow/oracle/ocw25/catalog/page/catalog/session/1745516222636001uDUL
"Leveraging Oracle Database 23ai for Intelligent Search and Assistant Apps [PRE1110] banner",https://reg.rf.oracle.com/flow/oracle/ocw25/catalog/page/catalog/session/1745337017170001kS97
"License to Innovate: Maximizing Business Value with Oracle’s Agentic AI  [PAN3799] banner",https://reg.rf.oracle.com/flow/oracle/ocw25/catalog/page/catalog/session/1754677281299001kAvp
"Logistics Product Strategy and Roadmap: AI-Driven Innovation and Efficiency [PAN3010] banner",https://reg.rf.oracle.com/flow/oracle/ocw25/catalog/page/catalog/session/1748888565431001iGOi
"Manufacturing Operations Management Strategy and Roadmap: AI & Smart Operations [PAN1064] banner",https://reg.rf.oracle.com/flow/oracle/ocw25/catalog/page/catalog/session/1744990348587001Li0v
"Mastering AI in Oracle CX: Craft AI Agents and Optimize Customer Interactions [PRE3076] banner",https://reg.rf.oracle.com/flow/oracle/ocw25/catalog/page/catalog/session/1749670629382001CxqJ
"Mastering AI in Oracle HCM: Crafting AI Agents & Enabling Embedded Efficiencies [PRE1108] banner",https://reg.rf.oracle.com/flow/oracle/ocw25/catalog/page/catalog/session/1745335006263001QjP4
"Mastering Oracle AI Agent Studio for Fusion Applications [SHO3671] banner",https://reg.rf.oracle.com/flow/oracle/ocw25/catalog/page/catalog/session/1752707285961001fp7Z
"Maximize Cloud Flexibility and Performance with Oracle Multicloud and AMD [THR3836] banner",https://reg.rf.oracle.com/flow/oracle/ocw25/catalog/page/catalog/session/1754953653967001te1P
"Maximizing Financial Insights with AI Agents, OTBI, SmartView & ERP Analytics [PRE1111] banner",https://reg.rf.oracle.com/flow/oracle/ocw25/catalog/page/catalog/session/1745337675149001ANOw
"Modernize and Extend SaaS Applications Using Oracle APEX [LRN1174] banner",https://reg.rf.oracle.com/flow/oracle/ocw25/catalog/page/catalog/session/1745546274218001JFbs
"Modernize Supply Chain Management with Fusion Data Intelligence, AI Agent Studio [LRN3832] banner",https://reg.rf.oracle.com/flow/oracle/ocw25/catalog/page/catalog/session/1754947789227001O3r9
"Modernizing Database Security and Compliance in Hybrid and Multicloud Fleets [LRN2981] banner",https://reg.rf.oracle.com/flow/oracle/ocw25/catalog/page/catalog/session/1748794164420001jiy3
"Modernizing Enterprise Ops with Oracle Cloud & AI: A Global Customer Panel [PAN3821] banner",https://reg.rf.oracle.com/flow/oracle/ocw25/catalog/page/catalog/session/1754939852943001kaGI
"Multimodal GenAI for the Enterprise: From Advanced Models to AI Avatars  [LRN3046] banner",https://reg.rf.oracle.com/flow/oracle/ocw25/catalog/page/catalog/session/1749146141006001XGgx
"Next Era of AI Agents: Agentic AI Fleets at Enterprise Scale [LRN1221] banner",https://reg.rf.oracle.com/flow/oracle/ocw25/catalog/page/catalog/session/1746023603574001IvZY
"Next-Gen Integrated Business Planning with Oracle Cloud EPM & Azure ML Platform [THR1778] banner",https://reg.rf.oracle.com/flow/oracle/ocw25/catalog/page/catalog/session/1747856710099001R9C3
"OCI Kubernetes Engine Powers AI Innovation at Scale [PAN1753] banner",https://reg.rf.oracle.com/flow/oracle/ocw25/catalog/page/catalog/session/1747848250014001rbk0
"OCI Storage Strategy and Roadmap, Featuring Uber's Cloud Migration Journey [LRN2824] banner",https://reg.rf.oracle.com/flow/oracle/ocw25/catalog/page/catalog/session/1748455923591001CmG5
"Oracle AI Agent Studio Meets Oracle Guided Journey in Procurement [THR3433] banner",https://reg.rf.oracle.com/flow/oracle/ocw25/catalog/page/catalog/session/1751306457999001zasl
"Oracle AI: Powering Your Business [KEY3665] banner",https://reg.rf.oracle.com/flow/oracle/ocw25/catalog/page/catalog/session/1752609095987001o4cu
"Oracle AI Vector Search Meets Google MCP Toolbox to Power Agentic AI [LRN3316] banner",https://reg.rf.oracle.com/flow/oracle/ocw25/catalog/page/catalog/session/1750898998203001oQXJ
"Oracle Analytics Cloud Roadmap, Strategy, and Vision [LRN1036] banner",https://reg.rf.oracle.com/flow/oracle/ocw25/catalog/page/catalog/session/1744826503047001Jl4R
"Oracle APEX: Generative AI Application Development [SHO3320] banner",https://reg.rf.oracle.com/flow/oracle/ocw25/catalog/page/catalog/session/1750899554562001AF70
"Oracle Autonomous Database Best Practices and Lessons Learned Customer Panel [PAN1155] banner",https://reg.rf.oracle.com/flow/oracle/ocw25/catalog/page/catalog/session/1745403195796001AbYk
"Oracle Cloud at the Edge: Enable Government Mission Continuity Anywhere, Anytime [LRN2866] banner",https://reg.rf.oracle.com/flow/oracle/ocw25/catalog/page/catalog/session/1748621175557001fwE1
"Oracle Cloud EPM: AI-Driven Connected Sales Planning [PAN3588] banner",https://reg.rf.oracle.com/flow/oracle/ocw25/catalog/page/catalog/session/1751492124569001MR6o
"Oracle Cloud EPM: Connected, Complete, AI-Powered [PAN3583] banner",https://reg.rf.oracle.com/flow/oracle/ocw25/catalog/page/catalog/session/1751491713522001z5U3
"Oracle Cloud EPM: Strategy and Innovation Roadmap [PAN3582] banner",https://reg.rf.oracle.com/flow/oracle/ocw25/catalog/page/catalog/session/1751491637535001N56D
"Oracle Cloud ERP: Financial Management Strategy and Innovation Roadmap [LRN3590] banner",https://reg.rf.oracle.com/flow/oracle/ocw25/catalog/page/catalog/session/1751492284379001F0SL
"Oracle Cloud ERP: Project Management Strategy and Innovation Roadmap [LRN3595] banner",https://reg.rf.oracle.com/flow/oracle/ocw25/catalog/page/catalog/session/1751492614378001uaHa
"Oracle Cloud for Higher Education: Student Strategy and Innovation Roadmap [PAN3579] banner",https://reg.rf.oracle.com/flow/oracle/ocw25/catalog/page/catalog/session/1751491226603001UGhe
"Oracle Enterprise Manager 24ai: Powered by GenAI [HOL2818] banner",https://reg.rf.oracle.com/flow/oracle/ocw25/catalog/page/catalog/session/1748412994789001iEIN
"Oracle Fusion Cloud EPM for Sustainability [PAN3587] banner",https://reg.rf.oracle.com/flow/oracle/ocw25/catalog/page/catalog/session/1751492061636001LLCx
"Oracle Fusion Cloud EPM: Reimagine Your Financial Close in the Cloud [PAN3584] banner",https://reg.rf.oracle.com/flow/oracle/ocw25/catalog/page/catalog/session/1751491863507001ylIk
"Oracle Fusion Data Intelligence and AI: Roadmap, Strategy, and Vision [LRN1037] banner",https://reg.rf.oracle.com/flow/oracle/ocw25/catalog/page/catalog/session/1744826644658001Qqsl
"Oracle Observability and Management GenAI Strategy and Roadmap [LRN2825] banner",https://reg.rf.oracle.com/flow/oracle/ocw25/catalog/page/catalog/session/1748456560653001wWUv
"Oracle Student Financial Aid: Customer View on AI and the Aid Lifecycle [PAN3578] banner",https://reg.rf.oracle.com/flow/oracle/ocw25/catalog/page/catalog/session/1751491082422001Lyn0
"Order Management Product Strategy and Roadmap: AI and Modern User Experience [LRN3013] banner",https://reg.rf.oracle.com/flow/oracle/ocw25/catalog/page/catalog/session/1748888811766001a9ZC
"Peek into OCI Engineering Innovations of Next-Gen Cloud and AI Infrastructure [LRN1684] banner",https://reg.rf.oracle.com/flow/oracle/ocw25/catalog/page/catalog/session/1747779176786001cnpi
"Personalizing SCM Redwood Applications Using Visual Builder Studio [HOL2963] banner",https://reg.rf.oracle.com/flow/oracle/ocw25/catalog/page/catalog/session/1748790041440001FiNM
"Powering Your AI/ML Workloads with Context-Aware Storage [LRN2863] banner",https://reg.rf.oracle.com/flow/oracle/ocw25/catalog/page/catalog/session/1748558210840001FZyI
"Procurement Agentic AI in Sourcing, Contracting, and Supplier Management [LRN3008] banner",https://reg.rf.oracle.com/flow/oracle/ocw25/catalog/page/catalog/session/1748888421641001dAu7
"Procurement Product Strategy & Roadmap: AI, Source-to-Pay Usability & Automation [LRN1063] banner",https://reg.rf.oracle.com/flow/oracle/ocw25/catalog/page/catalog/session/1744990035656001MXlD
"Progressive Modernization in Retail Banking [LRN2882] banner",https://reg.rf.oracle.com/flow/oracle/ocw25/catalog/page/catalog/session/1748634849427001nnvX
"Pros, Cons, and Tips to Drive Innovation on Oracle Database@Azure [LRN3831] banner",https://reg.rf.oracle.com/flow/oracle/ocw25/catalog/page/catalog/session/1754947591817001pJrS
""RAG in a Box”: Simplify and Accelerate Data Searches [LRN3302] banner",https://reg.rf.oracle.com/flow/oracle/ocw25/catalog/page/catalog/session/1750879582649001fDaH
"Rapid ChatBot Development with Oracle AI Optimizer and Toolkit [HOL2805] banner",https://reg.rf.oracle.com/flow/oracle/ocw25/catalog/page/catalog/session/1748410212187001oVtR
"Rapidly Deploy Models, Agentic Workflows, and Enterprise AI Solutions on OCI [THR3255] banner",https://reg.rf.oracle.com/flow/oracle/ocw25/catalog/page/catalog/session/1750805655901001SGOF
"Real-World AI Adoption with Oracle Analytics: A Birds-of-a-Feather Discussion [BOF3470] banner",https://reg.rf.oracle.com/flow/oracle/ocw25/catalog/page/catalog/session/1751316814057001nq6s
"Redefining Finance: Embracing the Era of Agentic AI [LRN3581] banner",https://reg.rf.oracle.com/flow/oracle/ocw25/catalog/page/catalog/session/1751491519776001dFra
"Reduce Complexity by Leveraging AI with Your EBS System [THR2104] banner",https://reg.rf.oracle.com/flow/oracle/ocw25/catalog/page/catalog/session/1747966277466001JWQr
"Redwood in Action: Pathways to Transformation [PAN3879] banner",https://reg.rf.oracle.com/flow/oracle/ocw25/catalog/page/catalog/session/1755226649979001LwoT
"RegReporting Reloaded: Benchmarking Today, Disrupting Tomorrow with AI [LRN2872] banner",https://reg.rf.oracle.com/flow/oracle/ocw25/catalog/page/catalog/session/1748629424714001FPwP
"Reimagining Finance at DHL Supply Chain with AI Agents Driving the Next Big Leap [LRN3936] banner",https://reg.rf.oracle.com/flow/oracle/ocw25/catalog/page/catalog/session/1755877003500001MG6L
"Reimagining Manufacturing with AI Agents [THR2920] banner",https://reg.rf.oracle.com/flow/oracle/ocw25/catalog/page/catalog/session/1748642678434001jUm9
"Reimagining Patient Care: The Future of Clinical Workflows with AI [LRN3187] banner",https://reg.rf.oracle.com/flow/oracle/ocw25/catalog/page/catalog/session/1750285504753001gfGX
"Revolutionizing McDonald's Operations with Oracle Fusion AI [LRN4006] banner",https://reg.rf.oracle.com/flow/oracle/ocw25/catalog/page/catalog/session/1756964672936001uVUK
"Revolutionizing Quote-to-Cash: How AI Is Transforming Revenue Operations [THR3980] banner",https://reg.rf.oracle.com/flow/oracle/ocw25/catalog/page/catalog/session/1756418410994001jQW4
"Rewriting the Rules: How AI Agents Are Poised to Reshape Our Work Completely [LRN3228] banner",https://reg.rf.oracle.com/flow/oracle/ocw25/catalog/page/catalog/session/1750719736230001ILfN
"Run Your Nvidia RAG on OCI with Secure Access Data from Azure and GCP [LRN1793] banner",https://reg.rf.oracle.com/flow/oracle/ocw25/catalog/page/catalog/session/1747861757363001BKmo
"Scalable Firewall Architectures in OCI [LRN2000] banner",https://reg.rf.oracle.com/flow/oracle/ocw25/catalog/page/catalog/session/1747943696280001Adlu
"Scaling Enterprise Apps with PostgreSQL and Cache on Oracle Cloud Infrastructure [LRN3648] banner",https://reg.rf.oracle.com/flow/oracle/ocw25/catalog/page/catalog/session/1752155882002001ukSP
"Seamless Integration of NVIDIA NIM into OCI Services for Optimized GenAI [LRN2626] banner",https://reg.rf.oracle.com/flow/oracle/ocw25/catalog/page/catalog/session/1748032521903001Qf2k
"Seamless Migration from MongoDB to Oracle: Best Practices and Strategies [SHO2817] banner",https://reg.rf.oracle.com/flow/oracle/ocw25/catalog/page/catalog/session/1748412645253001bj7n
"Select the Best Open Source LLMs Featuring Meta and Choctaw Nation [LRN1224] banner",https://reg.rf.oracle.com/flow/oracle/ocw25/catalog/page/catalog/session/1746023786661001LZSM
"Sentiment-Driven Agentic Automation for Drive-Thru Efficiency [SHO1372] banner",https://reg.rf.oracle.com/flow/oracle/ocw25/catalog/page/catalog/session/1746815401034001GfbY
"Serving Memory-Hungry LLMs at Scale with AMD Instinct GPUs on Oracle Cloud [LRN1371] banner",https://reg.rf.oracle.com/flow/oracle/ocw25/catalog/page/catalog/session/1746813021457001U6yt
"Shaping the Future with AI Infrastructure Advancements [LRN3341] banner",https://reg.rf.oracle.com/flow/oracle/ocw25/catalog/page/catalog/session/1750958892558001PCmk
"Simplifying Real-Time Communication Ecosystems: Connecting Voice with IT and AI [LRN1058] banner",https://reg.rf.oracle.com/flow/oracle/ocw25/catalog/page/catalog/session/1744929497429001kKC3
"Smart Audit AI: Recovering Hidden Profits from Invoice Oversights [LRN1539] banner",https://reg.rf.oracle.com/flow/oracle/ocw25/catalog/page/catalog/session/1747628121369001baCp
"Solving Real-World Finance and Accounting Challenges with Intelligent Automation [LRN3779] banner",https://reg.rf.oracle.com/flow/oracle/ocw25/catalog/page/catalog/session/1754575071006001csDa
"Speed-of-Thought Analytics at Scale with HeatWave MySQL Lakehouse [LRN2985] banner",https://reg.rf.oracle.com/flow/oracle/ocw25/catalog/page/catalog/session/1748795577467001EgFo
"Strategy to Success: Governments Transform HR with Oracle Fusion Cloud HCM [PAN2880] banner",https://reg.rf.oracle.com/flow/oracle/ocw25/catalog/page/catalog/session/1748633545958001bJmN
"Supercharging Call Center Agents and Revolutionizing Customer Interactions [THR3647] banner",https://reg.rf.oracle.com/flow/oracle/ocw25/catalog/page/catalog/session/1752100938524001NTZn
"Syneos Health’s Oracle Cloud ERP: Building a Digital Core for Future Innovation [PAN3880] banner",https://reg.rf.oracle.com/flow/oracle/ocw25/catalog/page/catalog/session/1755227161444001ovmF
"Talk to Your Data: Build Agentic Systems That Unlock Your Business Knowledge [LRN2526] banner",https://reg.rf.oracle.com/flow/oracle/ocw25/catalog/page/catalog/session/1748027370182001UjUo
"The Autonomous Data Engineer: The Superhero Enabling Generative AI [HOL2800] banner",https://reg.rf.oracle.com/flow/oracle/ocw25/catalog/page/catalog/session/1748409458495001LoCO
"The Complete Enterprise AI Stack: Frontier Models at Oracle  [PAN3048] banner",https://reg.rf.oracle.com/flow/oracle/ocw25/catalog/page/catalog/session/1749146889626001oZfu
"The Convergence of Transformative Technologies in Retail [THR3893] banner",https://reg.rf.oracle.com/flow/oracle/ocw25/catalog/page/catalog/session/1755279954138001KfLl
