"The End of Business as Usual: Reinventing Models for a Disrupted World [THR3651] banner",https://reg.rf.oracle.com/flow/oracle/ocw25/catalog/page/catalog/session/1752182703408001Bx4t
"The Future of Generative AI: Innovation Engineered for Your Data [LRN3047] banner",https://reg.rf.oracle.com/flow/oracle/ocw25/catalog/page/catalog/session/1749146655632001evR9
"The Magic of AI in APEX: How Hard Can It Be? [BOF1185] banner",https://reg.rf.oracle.com/flow/oracle/ocw25/catalog/page/catalog/session/1745717667019001zDkv
"The Multi-Agent Advantage: Drive Real AI Value with IBM and Oracle [SOL3895] banner",https://reg.rf.oracle.com/flow/oracle/ocw25/catalog/page/catalog/session/1755281525111001DY2O
"The Present and the Future with MySQL and HeatWave [LRN3224] banner",https://reg.rf.oracle.com/flow/oracle/ocw25/catalog/page/catalog/session/1750717151937001kbBo
"The Real-Time AI Stack: Streaming with GoldenGate, Agents, and Vectors [LRN3158] banner",https://reg.rf.oracle.com/flow/oracle/ocw25/catalog/page/catalog/session/1750257251554001xk7n
"The Rise of Micro AI: From Broad Strategies to Domain-Specific Intelligence [PAN3914] banner",https://reg.rf.oracle.com/flow/oracle/ocw25/catalog/page/catalog/session/1755612754595001lBKp
"The Rise of the Prompt Professional: Why CX’s Future Belongs to Orchestrators [THR2830] banner",https://reg.rf.oracle.com/flow/oracle/ocw25/catalog/page/catalog/session/1748457796971001kA1M
"Thinking Beyond Technology: How to Embark on a Successful AI Adoption Journey [PAN3124] banner",https://reg.rf.oracle.com/flow/oracle/ocw25/catalog/page/catalog/session/1750091742383001HnOM
"Top 10 Tips for Implementing Oracle HCM Successfully [LRN2582] banner",https://reg.rf.oracle.com/flow/oracle/ocw25/catalog/page/catalog/session/1748030658127001e8is
"Top 5 OCI Compute and AI Infrastructure Announcements and Highlights [THR3488] banner",https://reg.rf.oracle.com/flow/oracle/ocw25/catalog/page/catalog/session/1751319936851001LhHJ
"Trace Data Lineage with AI Vector Search and Knowledge Graphs in Oracle AI Database [HOL2813] banner",https://reg.rf.oracle.com/flow/oracle/ocw25/catalog/page/catalog/session/1748411728178001ZtWu
"Train Faster, Scale Smarter: Discover Why Advanced AI Models Are Trained on OCI [LRN3345] banner",https://reg.rf.oracle.com/flow/oracle/ocw25/catalog/page/catalog/session/1750959735734001cpQY
"Transformation Unplugged: Real-World Stories with Infosys and Oracle [PAN4017] banner",https://reg.rf.oracle.com/flow/oracle/ocw25/catalog/page/catalog/session/1757085540625001yNsz
"Transform Business Operations with Oracle Fusion Cloud ERP and EPM [PAN4008] banner",https://reg.rf.oracle.com/flow/oracle/ocw25/catalog/page/catalog/session/1757014670278001Lvoz
"Transforming Colleges: 2025 Challenges and the Path Forward [PAN2861] banner",https://reg.rf.oracle.com/flow/oracle/ocw25/catalog/page/catalog/session/1748550564928001eQLR
"Transforming Oracle Cloud HCM with Oracle AI: From Traditional to Agentic AI [LRN3955] banner",https://reg.rf.oracle.com/flow/oracle/ocw25/catalog/page/catalog/session/1756142406706001cyA8
"Transforming People Intelligence with AI and Fusion Data Intelligence HCM [LRN2876] banner",https://reg.rf.oracle.com/flow/oracle/ocw25/catalog/page/catalog/session/1748632246983001FNIc
"Trinity Industries’ Journey from EBS to Cloud  [THR3990] banner",https://reg.rf.oracle.com/flow/oracle/ocw25/catalog/page/catalog/session/1756486723051001jXzX
"Turbocharge Your Applications with OCI Shapes Powered by 5th Gen AMD EPYC [LRN3826] banner",https://reg.rf.oracle.com/flow/oracle/ocw25/catalog/page/catalog/session/1754945285440001rL7d
"Turn Data into Action: Spatially Aware AI Agent Systems with Oracle Database [THR2698] banner",https://reg.rf.oracle.com/flow/oracle/ocw25/catalog/page/catalog/session/1748036892932001THCX
"Turn Raw Data into Business Knowledge with Intelligent Agents  [THR3079] banner",https://reg.rf.oracle.com/flow/oracle/ocw25/catalog/page/catalog/session/1749741179841001RUGt
"Unified Data Meets Azure Intelligence: Fabric, Foundry and Copilot in Action [LRN3888] banner",https://reg.rf.oracle.com/flow/oracle/ocw25/catalog/page/catalog/session/1755275375411001lpUw
"Unleashing AI Agents to Help Unlock Value for Your Organization [SPO3962] banner",https://reg.rf.oracle.com/flow/oracle/ocw25/catalog/page/catalog/session/1756232904565001laE9
"Unleash the Power of AI in Oracle Cloud SCM [HOL3441] banner",https://reg.rf.oracle.com/flow/oracle/ocw25/catalog/page/catalog/session/1751307581019001L9Ad
"Unlock AI’s Full Potential: Why Master Data Management Is Your Hidden Advantage [LRN3961] banner",https://reg.rf.oracle.com/flow/oracle/ocw25/catalog/page/catalog/session/1756230913095001cx8L
"Unlock Business Value with HCM AI Acceleration [THR3833] banner",https://reg.rf.oracle.com/flow/oracle/ocw25/catalog/page/catalog/session/1754948052428001Y3FR
"Unlock Generative AI Through APIs with OCI and Traefik [SHO3254] banner",https://reg.rf.oracle.com/flow/oracle/ocw25/catalog/page/catalog/session/1750805068773001AoGw
"Unlocking Agentic AI: Insights to Transform [SOL3753] banner",https://reg.rf.oracle.com/flow/oracle/ocw25/catalog/page/catalog/session/1754329324815001XSpM
"Unlocking Efficiency and Optimization in Commercial Flows [LRN3894] banner",https://reg.rf.oracle.com/flow/oracle/ocw25/catalog/page/catalog/session/1755280053878001Qz4p
"Unlocking the AI Agent Ecosystem through Scale and Interoperability [PAN2785] banner",https://reg.rf.oracle.com/flow/oracle/ocw25/catalog/page/catalog/session/1748335267836001a5jZ
"Unlock Revenue with Digital Business Experiences Powered by AI and Siebel CRM [LRN1055] banner",https://reg.rf.oracle.com/flow/oracle/ocw25/catalog/page/catalog/session/1744929289155001UzYm
"Unlock Your GPU Capacity with NVIDIA Lepton on OCI  [LRN3343] banner",https://reg.rf.oracle.com/flow/oracle/ocw25/catalog/page/catalog/session/1750959337332001I28I
"Untangling Finance Transformation for FIs: Reimagining Control and Insight [LRN2870] banner",https://reg.rf.oracle.com/flow/oracle/ocw25/catalog/page/catalog/session/1748629193337001fh3a
"Using Process Intelligence and AI to Lead Modernization [LRN3975] banner",https://reg.rf.oracle.com/flow/oracle/ocw25/catalog/page/catalog/session/1756408661430001Wq2O
"VMware Cloud Foundation on Oracle: What’s Next for OCVS in Broadcom Era [LRN2022] banner",https://reg.rf.oracle.com/flow/oracle/ocw25/catalog/page/catalog/session/1747946825803001i1QK
"What’s New, What’s Next: Oracle APEX 25.1 and Generative Development [LRN3176] banner",https://reg.rf.oracle.com/flow/oracle/ocw25/catalog/page/catalog/session/1750265559719001xvyc
"Winning on Physical and Digital Battlefields with OCI [LRN3253] banner",https://reg.rf.oracle.com/flow/oracle/ocw25/catalog/page/catalog/session/1750803321488001gG1j
"Your Oracle Data, Powered by Gemini: A New Era of AI-Driven Applications [SPO3855] banner",https://reg.rf.oracle.com/flow/oracle/ocw25/catalog/page/catalog/session/1755099891068001PkeR
"Your Voice to Vision: Guiding the Future of OCI Compute and AI Infrastructure [BOF3512] banner",https://reg.rf.oracle.com/flow/oracle/ocw25/catalog/page/catalog/session/1751321063515001FY3r
